id,Item Description,Amount,Spend Category,Cost Center,Department,Project Code
1,"Purchase of 25 Dell XPS 13 laptops with 32GB RAM, 1TB SSD for software development team including extended warranty and support package",32499.75,Hardware,IT-001,Information Technology,TECH-2024-001
2,Annual enterprise subscription for Microsoft Office 365 E5 licenses covering 500 employees with advanced security features and Teams Phone System,125000.0,Software Licenses,IT-001,Information Technology,SW-2024-001
3,"AWS Cloud Services for Q1 including EC2 instances, RDS databases, S3 storage, and Lambda functions for production environment",85000.0,Cloud Services,IT-002,Information Technology,CLOUD-2024-Q1
4,"Implementation of Cisco Meraki network infrastructure including 50 access points, 10 switches, and 3-year support contract",75000.0,Network Equipment,IT-003,Information Technology,NET-2024-001
5,"Comprehensive cybersecurity solution including endpoint protection, network monitoring, and incident response system with 24/7 SOC support",95000.0,Security Software,IT-001,Information Technology,SEC-2024-001
6,"Corporate campus upgrade of videoconferencing systems in 15 conference rooms including displays, cameras, and audio equipment with installation",125000.0,IT Equipment,IT-002,Information Technology,AV-2024-001
7,"Annual renewal of enterprise software development tools including JetBrains, GitHub Enterprise, and Azure DevOps for 100 developers",85000.0,Development Tools,IT-001,Information Technology,DEV-2024-001
8,"Implementation of new employee onboarding system including workflow automation, document management, and integration with HR systems",65000.0,HR Software,HR-001,Human Resources,HR-2024-001
9,"Company-wide leadership development program for 50 senior managers including workshops, coaching sessions, and assessment tools",175000.0,Training Programs,HR-002,Human Resources,LEAD-2024-001
10,"Annual health insurance premium for comprehensive employee coverage including medical, dental, and vision for 500 employees and dependents",2500000.0,Employee Benefits,HR-003,Human Resources,BEN-2024-001
11,"Global digital marketing campaign across social media platforms including content creation, ad spend, and performance analytics for Q2",250000.0,Digital Advertising,MKT-001,Marketing,DIG-2024-Q2
12,"Complete website redesign project including UX research, design, development, content migration, and SEO optimization",185000.0,Website Development,MKT-002,Marketing,WEB-2024-001
13,"Annual industry conference sponsorship package including booth space, speaking slot, and VIP customer event at Tech Summit 2024",145000.0,Event Marketing,MKT-003,Marketing,CONF-2024-001
14,"Implementation of new ERP system including financial management, procurement, and reporting modules with data migration",450000.0,Accounting Software,FIN-001,Finance,ERP-2024-001
15,"External audit services for FY2024 including financial statement audit, SOX compliance, and IT controls assessment",275000.0,Audit Services,FIN-002,Finance,AUDIT-2024
16,"Warehouse automation system including robotics, conveyor systems, and inventory management software for primary distribution center",850000.0,Manufacturing Equipment,OPS-001,Operations,AUTO-2024-001
17,"Research laboratory expansion including new testing equipment, clean room construction, and environmental control systems",1250000.0,Lab Equipment,RD-001,Research & Development,LAB-2024-001
18,"Legal case management platform implementation including document management, workflow automation, and compliance tracking",165000.0,Legal Software,LEG-001,Legal,LEGAL-2024-001
19,"Headquarters building lease annual payment including utilities, maintenance, and property tax for 50,000 sq ft office space",2250000.0,Building Lease,FAC-001,Facilities,LEASE-2024
20,"Corporate security system upgrade including access control, surveillance cameras, and central monitoring station for all facilities",375000.0,Security Services,FAC-002,Facilities,SEC-2024-001
21,"Enterprise-wide Salesforce implementation including Sales Cloud, Service Cloud, and Marketing Cloud with custom development and data migration from legacy CRM",385000.0,CRM Software,SALES-001,Sales,CRM-2024-001
22,"Comprehensive sales training program for 100 sales representatives including product knowledge, negotiation skills, and virtual selling techniques with 6 months of coaching follow-up",225000.0,Sales Training,SALES-002,Sales,TRN-2024-001
23,"Global business process optimization project including workflow analysis, system integration, and implementation of automation tools across 5 key business units",450000.0,Process Improvement,PS-001,Professional Services,BPO-2024-001
24,"Data center consolidation project including server migration, network reconfiguration, and implementation of new backup and disaster recovery systems across 3 locations",750000.0,IT Infrastructure,IT-001,Information Technology,DC-2024-001
25,"Employee wellness program expansion including mental health support, fitness center equipment, virtual wellness classes, and health screening services for all locations",275000.0,Wellness Programs,HR-001,Human Resources,WELL-2024-001
26,"Digital content creation suite including video production equipment, editing software, and studio setup for in-house marketing content development",185000.0,Content Creation,MKT-001,Marketing,CONT-2024-001
27,"Treasury management system implementation including cash forecasting, bank integration, and investment portfolio management modules with real-time reporting",295000.0,Treasury Services,FIN-001,Finance,TMS-2024-001
28,"Manufacturing line upgrade including robotic assembly systems, quality control stations, and IoT sensors for real-time production monitoring at main plant",1250000.0,Manufacturing Equipment,OPS-001,Operations,MFG-2024-001
29,"Research and development project for next-generation product including prototype development, testing equipment, and specialized software licenses for simulation",850000.0,R&D Equipment,RD-001,Research & Development,RD-2024-001
30,"Corporate compliance management system including policy management, training delivery, incident tracking, and regulatory reporting capabilities",225000.0,Compliance Tools,LEG-001,Legal,COMP-2024-001
31,"Smart building management system implementation including energy monitoring, automated HVAC control, and predictive maintenance capabilities for headquarters building",475000.0,Building Management,FAC-001,Facilities,BMS-2024-001
32,"Customer journey analytics platform including multi-channel tracking, behavioral analysis, and predictive modeling capabilities with machine learning integration",325000.0,Marketing Analytics,MKT-002,Marketing,ANAL-2024-001
33,"Mobile device management solution for 2500 corporate devices including security policies, app management, and remote wipe capabilities with 24/7 support",185000.0,Mobile Device Management,IT-002,Information Technology,MDM-2024-001
34,"Supply chain optimization project including inventory management software, warehouse automation, and supplier portal implementation across global operations",925000.0,Supply Chain Management,OPS-002,Operations,SCM-2024-001
35,"Professional development platform including personalized learning paths, skill assessments, and certification tracking for 1000 employees with content library access",245000.0,Training Programs,HR-002,Human Resources,LEARN-2024-001
36,"Enterprise data analytics platform implementation including data warehouse, visualization tools, and self-service reporting capabilities with training program",575000.0,Business Intelligence,IT-003,Information Technology,BI-2024-001
37,"Global recruiting platform including AI-powered candidate screening, video interviewing capabilities, and integration with background check services",225000.0,HR Software,HR-001,Human Resources,REC-2024-001
38,"Product lifecycle management system implementation including design collaboration, document control, and integration with CAD and ERP systems",425000.0,PLM Software,RD-002,Research & Development,PLM-2024-001
39,"Environmental monitoring and compliance system including air quality sensors, waste management tracking, and automated regulatory reporting capabilities",285000.0,Environmental Services,OPS-003,Operations,ENV-2024-001
40,"Corporate performance management system including budgeting, forecasting, and financial consolidation modules with regulatory reporting capabilities",375000.0,Financial Software,FIN-002,Finance,CPM-2024-001
41,"Advanced cybersecurity implementation including zero trust architecture, privileged access management, and security information and event management (SIEM) system",525000.0,Security Software,IT-001,Information Technology,SEC-2024-002
42,"Employee experience platform including internal communications, collaboration tools, and employee feedback mechanisms with mobile app access",245000.0,HR Software,HR-002,Human Resources,EX-2024-001
43,"Marketing automation platform upgrade including advanced segmentation, AI-powered personalization, and multi-channel campaign orchestration capabilities",325000.0,Marketing Automation,MKT-001,Marketing,AUTO-2024-001
44,"Risk management system implementation including credit risk assessment, market risk analysis, and operational risk monitoring with regulatory reporting",450000.0,Risk Management,FIN-003,Finance,RISK-2024-001
45,"Quality management system implementation including process control, documentation management, and audit management across manufacturing facilities",375000.0,Quality Control,OPS-001,Operations,QMS-2024-001
46,"Research data management platform including secure storage, analysis tools, and collaboration features for global research teams with compliance controls",285000.0,Research Software,RD-001,Research & Development,RDM-2024-001
47,"Contract lifecycle management system including template library, workflow automation, and electronic signature integration with audit trail",225000.0,Legal Software,LEG-002,Legal,CLM-2024-001
48,"Facility management system upgrade including maintenance scheduling, space management, and vendor management with mobile access for facility teams",325000.0,Facility Management,FAC-001,Facilities,FM-2024-001
49,"Sales enablement platform including content management, training delivery, and performance analytics with CRM integration for global sales team",275000.0,Sales Enablement,SALES-001,Sales,SE-2024-001
50,"Change management program implementation including communication platform, training materials, and progress tracking tools for digital transformation initiative",425000.0,Change Management,PS-001,Professional Services,CHG-2024-001
51,"Enterprise collaboration platform including team workspaces, document sharing, and real-time communication tools with security and compliance features",385000.0,Collaboration Tools,IT-002,Information Technology,COLLAB-2024-001
52,"Talent management suite including performance management, succession planning, and career development tools with analytics dashboard",295000.0,HR Software,HR-001,Human Resources,TM-2024-001
53,"Customer data platform implementation including data unification, segmentation capabilities, and integration with marketing and sales systems",445000.0,Marketing Technology,MKT-002,Marketing,CDP-2024-001
54,"Financial planning and analysis system including budgeting, forecasting, and scenario planning capabilities with automated reporting",375000.0,Financial Software,FIN-001,Finance,FP&A-2024-001
55,"Manufacturing execution system implementation including production scheduling, quality control, and real-time monitoring across multiple production lines",725000.0,Manufacturing Software,OPS-001,Operations,MES-2024-001
56,"Laboratory information management system including sample tracking, workflow automation, and regulatory compliance features for R&D facilities",385000.0,Lab Management,RD-002,Research & Development,LIMS-2024-001
57,"E-discovery platform implementation including document collection, processing, and review capabilities with AI-powered analytics",425000.0,Legal Software,LEG-001,Legal,EDIS-2024-001
58,"Energy management system implementation including consumption monitoring, optimization algorithms, and sustainability reporting for all facilities",475000.0,Energy Management,FAC-002,Facilities,EMS-2024-001
59,"Sales territory optimization system including geographic planning, account assignment, and performance tracking with mobile access",285000.0,Sales Planning,SALES-002,Sales,TERR-2024-001
60,"Project portfolio management system including resource allocation, timeline tracking, and financial management with executive dashboard",345000.0,Project Management,PS-002,Professional Services,PPM-2024-001
